S. NO. ,Plants,Soil preperation,Germination ,Water req.,Compost Req.,Pot size,Uses,Timeline,Special Care Points
24,Mint,Mixture of 50% garden soil + 50% compost,New mint plant can be grown from old mint plant leaves. Take a few thick stems of mint plant. Remove the leaves from the bottom 2 inches of the cuttings. Make fresh cuts at the bottom of the stem. Now push the bare stem 2-3 inches deep into the soil. ,Once a day. Make sure to keep the soil moist at all times.,Add compost every 30-45 days.,Medium sized pot with proper drainage system.,"In addition to freshening breath, mint is also used to add flavor to foods and drinks. Mint is most popularly known as a remedy for digestive problems. Taking peppermint oil reduces abdominal pain and helps treat irritable bowel syndrome without producing side effects. ",After 6-8 days the old leaves fall off and new leaves will emerge from the nodes. After 15 days shift the plant to direct sunlight for more compact growth. After 22 days the plant grows upto 6-8 inches. After 32 days the new cuttings have emerged and blossomed. After 45 days the cuttings are fully grown and are ready for transplantation. Seperate the roots for each cutting and plant them into individual pots. After few weeks of transplantation each plant will become bushier.,During intial plant growth do not let the soil to dry out.
25,Tulsi,Mixture of 70% garden soil+ 30% compost.,Take seeds of tulsi and spread it over the soil surface and cover it with the soil surface.,Once a day. Make sure to keep the soil moist at all times.,Add compost every 30-45 days.,Take a small shallow pot for germination. And for individual plants you can take as big plant as large crop of tulsi you want to produce.,Basil most popularly known as Tulsi has been used for thousands of years in Ayurveda for its diverse healing properties. The leaves strengthen the stomach and help in respiratory diseases. Kidney Stone: Basil has strengthening effect on the kidney,After 7 days the seeds start to germinate. After 12 days more seedlings start to germinate. After 15 days the seedlings grow upto an inch. After 18 days all the seedlings become four leafed. After 40 days these plants become 5-6 inches tall and are ready for transplantation. After transplantation the plant continues to grow for months.,Keep the plant in full sun.
26,Coriander,Mixture of 50% garden soil + 50% compost,Distribute the seeds evenly in a straight line with a distance of 1-2 inches in between them and cover them with thin layer of soil.,Once a day. Make sure to keep the soil moist at all times.,Add the compost each time you harvest the crop.,"Pot which is wide and at least 10-12 inches deep, with proper drainage. ","Coriander is a fragrant, antioxidant-rich herb that has many culinary uses and health benefits. It may help lower your blood sugar, fight infections, and promote heart, brain, skin, and digestive health. You can easily add coriander seeds or leaves — sometimes known as cilantro — to your diet.","They start to germinate in 7-9 days. After 17 days they grow upto an inch. After 23 days they grow upto 5-6 inches.  After 28 days when they are allmost 6 inches long they are ready to be harvested. Cut up to 1/2 of th eleaves each week, as this will encourage the plant to keep growing.",Keep the plant in full sun but make sure the afternoon direct sunlight is not falling onto the plant.
27,Curry leaf,Germinate the plant only in garden soil. Use 70% garden soil+ 30 % compost mixture once the plant is steady in the pot.,"Take a stem cutting of the curry plant of width about 1/2 to 1 inch and cut one end diognally, dip it in the rooting hormone and bury this side in 1-2 inch depth in the soil.",Once a day. Make sure to keep the soil moist at all times.,Add compost every 30-45 days.,Use any medium sized pot with proper drainage holes.,"You can use the leaves in your cooking, and as an added bonus, this plant is also stunning as an ornamental. It has an elegant bush-like growth pattern that stands out in the garden, and when you brush the leaves, they release their pungent, spicy aroma",After about 25 days the new leaves start to appear on the stem. As the time goes the leaves will slowly grow and in about 60 days the new leaves will be covering the plant surface.,Initially keep the plant in shade. When the leaves start to appear shift the plant in the full sunlight.
28,Gotu Kola,Mixture of 50% garden soil+ 30% compost + 20% sand.,Take some thick stem with healthy leaves on them and remive the leaves from its lower end. Bury the lower sideof the stem in the soil about1-1.5 inches deep.,Once a day. Make sure to keep the soil moist at all times.,Add compost every 30-45 days.,Use any medium sized pot with little drainage holes.,"Gotu kola has the ability to enhance memory and nerve function, which gives it potential in treating Alzheimer’s disease. ",After 25 days of sowing the stem in the soil the leaves become bigger and the plant start to be adjusted and growing well.  You can continue to water it regularly and giving it compost at desired frequency and the plant will grow well without any problems.,Keep the plant away from direct sunlight and keep it in shade always. Also provide support to the creeping stem of the money plant.
29,Thyme,Take mixture of 60% compost + 40 % soil for germination.  While use 70% soil + 30% compost for the further growth.,Spread the seeds over the soil surface and cover them with the thin layer of soil.,Once a day. Make sure to keep the soil moist at all times.,Add compost every 30-45 days.,Use small pot for germination and use medium sized pots for individual plants.,"Thyme is an herb. The flowers, leaves, and oil are used as medicine. Thyme is sometimes used in combination with other herbs. Thyme is used for swelling (inflammation) of the main airways in the lung (bronchitis), cough, patchy hair loss (alopecia areata), stomach problems, and many other conditions.",After about 21 days the seeds start to germinate. After a few weeka when the plant is about 4 inches tall transplant it to the individual pot. Gradually the plant will grow to cover the whole soil surface.,Keep the germination pot in warm and damp place. After transplantation shift them to a place with moderate sunlight.
30,Rosemary ,Take a mixture of 30% garden soil+30% sand + 40% vermicompost,"Clip a three-inch cutting from the very tip of a stem, remove the leaves one inch from the base, apply rooting hormone on the exposed portion of the stem, and plant it in the soil.",Once in 2-3 days. Make sure the soil dry out before you water the plant.,Add compost every 30-45 days.,Use any medium sized pot with proper drainage holes.,"Rosemary is a rich source of antioxidants and anti-inflammatory compounds, which are thought to help boost the immune system and improve blood circulation. Rosemary is considered a cognitive stimulant and can help improve memory performance and quality. It is also known to boost alertness, intelligence, and focus.",After 25 days of sowing the stem in the soil the leaves become bigger and the plant start to be adjusted and growing well.  You can continue to water it regularly and giving it compost at desired frequency and the plant will grow well without any problems.,It  is a wild low requirement plant. 
